{
  "cegs": "0.1",
  "id": "cegs:evidence:ca:iaac-registry-darlington-smr",
  "type": "evidence",
  "source_url": "https://iaac-aeic.gc.ca/050/evaluations/proj/80023",
  "publisher": "Impact Assessment Agency of Canada",
  "source_tier": 1,
  "content_hash": "e3b0c44298fc1c149afbf4c8996fb92427ae41e4649b934ca495991b7852b855",
  "retrieval_timestamp": "2026-01-10T08:30:00Z",
  "publication_date": "2026-01-08T14:00:00Z",
  "effective_date": "2026-01-08T14:00:00Z",
  "confidence": "VERIFIED",
  "extraction_method": "official_iaac_json_adapter",
  "raw_snippet": "Notice of Commencement of an Impact Assessment: Ontario Power Generation Darlington New Nuclear Project."
}
